{
  "$schema": "https://json-schema.org/draft/2020-12/schema",
  "$id": "https://github.com/schwichtgit/spec-gates/runtime/policy.schema.json",
  "title": "spec-gates policy",
  "description": "Declarative gate policy for Spec Kit projects. Consumed by .specify/gates/lib/policy.sh at runtime and validated by /speckit.gates.init and /speckit.gates.upgrade.",
  "type": "object",
  "additionalProperties": false,
  "required": ["hooks"],
  "properties": {
    "_comment": {
      "type": "string",
      "description": "Free-form note field. Ignored by the loader. Authored copies may reference this schema URL here."
    },
    "$schema": {
      "type": "string",
      "description": "Optional schema reference for editor tooling."
    },
    "extends": {
      "type": "object",
      "additionalProperties": false,
      "required": ["source", "version"],
      "description": "Versioned baseline contract (feature 003). This policy file becomes an overlay on the named baseline: /speckit.gates.sync fetches source@version once, pins it (baseline.lock.json), snapshots it (baseline.json), and materializes the merged effective policy (policy.effective.json) that every boundary enforces. Absent = the contract machinery is fully dormant.",
      "properties": {
        "source": {
          "type": "string",
          "minLength": 1,
          "description": "Anything git accepts as a remote: https/ssh URL, file:// URL, or local path to the baseline repository."
        },
        "version": {
          "type": "string",
          "minLength": 1,
          "description": "Tag or commit identifier to pin. Branch names are refused at sync time \u2014 a moving pin is not a pin."
        },
        "file": {
          "type": "string",
          "minLength": 1,
          "default": "policy.json",
          "description": "Path of the baseline policy document inside the source repository."
        }
      }
    },
    "hooks": {
      "type": "object",
      "description": "Map of hook name to hook stanza. Hook names are free-form strings matching the name used by gates_policy_get / gates_policy_list callers. gates, gate_timeout_s and test_severity are accepted only under verify-quality.",
      "properties": {
        "verify-quality": {
          "$ref": "#/$defs/hook"
        }
      },
      "additionalProperties": {
        "$ref": "#/$defs/hook",
        "properties": {
          "gates": false,
          "gate_timeout_s": false,
          "test_severity": false
        }
      }
    },
    "protected_files": {
      "type": "object",
      "additionalProperties": false,
      "description": "Files refused at the agent PreToolUse boundary, on top of the built-in secret/key defaults. At the git boundary a staged match needs a Protected-Change trailer (see git.protected_change_trailer).",
      "properties": {
        "extra": {
          "type": "array",
          "items": {
            "type": "string"
          },
          "description": "Additional paths or globs to protect."
        }
      }
    },
    "git": {
      "type": "object",
      "additionalProperties": false,
      "description": "Toggles for the git-boundary hooks (pre-commit / commit-msg).",
      "properties": {
        "block_main_commits": {
          "type": "boolean",
          "default": true,
          "description": "Refuse direct commits to main/master (override per-commit with GATES_ALLOW_MAIN_COMMIT=1)."
        },
        "conventional_commits": {
          "type": "boolean",
          "default": true,
          "description": "Require Conventional Commits subject format in commit-msg."
        },
        "forbid_ai_isms": {
          "type": "boolean",
          "default": true,
          "description": "Reject AI-ism / self-referential phrasing in commit messages and PRs."
        },
        "protected_change_trailer": {
          "type": "boolean",
          "default": true,
          "description": "Let a staged protected_files.extra path through the git boundary only when the commit message carries a 'Protected-Change: <path>' trailer for every staged protected path plus 'Approved-By: <name>' (checked in commit-msg). false restores the unconditional pre-commit refusal, from the commit after the one that turns it off: that commit is judged by HEAD's policy and passes with its trailers. The agent boundary refuses protected edits either way."
        },
        "block_bulk_staging": {
          "type": "boolean",
          "default": false,
          "x-since": "0.4.0",
          "description": "Refuse bulk staging at the agent boundary: git add -A / --all / . / :/ / *, or a directory argument. Explicit file paths, -u, --renormalize, git commit -a and -p stay allowed. The git boundary cannot tell how the index was filled, so this rule is agent-boundary only."
        },
        "ai_branding": {
          "type": "object",
          "additionalProperties": false,
          "description": "AI-branding rule of git.forbid_ai_isms, applied by commit-msg and the PR validator.",
          "properties": {
            "terms": {
              "type": "array",
              "items": {
                "type": "string",
                "minLength": 1
              },
              "default": ["Anthropic", "GPT", "OpenAI", "Copilot"],
              "description": "Terms refused as whole words, case-insensitive, matched literally. An empty list disables the branding check (the standalone 'Claude' rule stays)."
            },
            "allow_phrases": {
              "type": "array",
              "items": {
                "type": "string",
                "minLength": 1
              },
              "default": [],
              "description": "Literal phrases, matched ignoring case, removed from the message before the branding and standalone 'Claude' checks, e.g. a product or branch name that contains a term."
            }
          }
        }
      }
    },
    "attestation": {
      "type": "object",
      "additionalProperties": false,
      "description": "Gate-run evidence settings: attestation records appended per verify.sh run and the pins-based parity gate. Optional; absence means all defaults apply (enabled, 200 records, parity error).",
      "properties": {
        "enabled": {
          "type": "boolean",
          "default": true,
          "description": "Append an attestation record to .specify/gates/attestations.jsonl on every verify.sh run (and embed it in --json). false also disables the parity gate; canaries are unaffected."
        },
        "max_records": {
          "type": "integer",
          "minimum": 1,
          "default": 200,
          "description": "Cap on attestation log lines; the oldest records are dropped once the cap is exceeded."
        },
        "parity": {
          "type": "string",
          "enum": ["error", "warning", "off"],
          "default": "error",
          "description": "Severity of the synthetic parity gate when a resolved tool version drifts from its lockfile pin: error fails the run, warning reports without failing, off omits the gate."
        }
      }
    },
    "spec": {
      "type": "object",
      "additionalProperties": false,
      "description": "Spec-conformance gate settings: fenced accept blocks in specs/*/tasks.md run as executable acceptance criteria; features whose spec.md Status is Complete are enforced. Optional; absence means all defaults apply (enabled, error, all features, 30s timeout).",
      "properties": {
        "enabled": {
          "type": "boolean",
          "default": true,
          "description": "Run the spec gate on every verify.sh run. false removes the spec gate entry and the attestation spec object."
        },
        "severity": {
          "type": "string",
          "enum": ["error", "warning"],
          "default": "error",
          "description": "How enforcement failures (unchecked tasks, failing accept blocks, parse errors) map to the run result: error fails the run, warning reports without failing."
        },
        "include": {
          "type": "array",
          "items": {
            "type": "string"
          },
          "default": ["*"],
          "description": "Feature-directory-name globs eligible for enforcement when marked Complete. Non-matching complete features stay informational."
        },
        "exclude": {
          "type": "array",
          "items": {
            "type": "string"
          },
          "default": [],
          "description": "Feature-directory-name globs skipped entirely (not discovered)."
        },
        "timeout_s": {
          "type": "integer",
          "minimum": 1,
          "default": 30,
          "description": "Per-accept-block watchdog seconds; an exceeded budget fails that criterion."
        },
        "snapshot_exclude": {
          "type": "array",
          "items": {
            "type": "string",
            "not": {
              "pattern": "^[*/?]+$"
            }
          },
          "default": [],
          "description": "Repository-relative path globs of untracked or gitignored files left out of the accept-block read-only check, for files another process writes while blocks run (an editor or plugin cache). A trailing slash names a directory and everything under it (\"cache/\" equals \"cache/**\"). A pattern of only *, ? and / would exempt every path and is refused. Tracked files are always checked."
        }
      }
    }
  },
  "$defs": {
    "hook": {
      "type": "object",
      "additionalProperties": false,
      "required": ["severity"],
      "allOf": [
        {
          "if": {
            "properties": {
              "orchestrator": {
                "const": "custom"
              }
            },
            "required": ["orchestrator"]
          },
          "then": {
            "required": ["custom_command"],
            "properties": {
              "custom_command": {
                "type": "string",
                "minLength": 1
              }
            }
          }
        }
      ],
      "properties": {
        "include": {
          "type": "array",
          "items": {
            "type": "string"
          },
          "description": "Glob patterns selecting files in scope. Consumed by config generators."
        },
        "exclude": {
          "type": "array",
          "items": {
            "type": "string"
          },
          "description": "Glob patterns excluded from scope. Consumed by config generators."
        },
        "orchestrator": {
          "type": "string",
          "enum": ["none", "task", "custom"],
          "description": "Dispatch style. none = invoke the native tool directly. task = delegate to a Taskfile target. custom = invoke the command in custom_command."
        },
        "severity": {
          "type": "string",
          "enum": ["error", "warning", "info"],
          "description": "How the hook's overall exit code maps to caller-visible severity."
        },
        "on_missing_runner": {
          "deprecated": true,
          "type": "string",
          "enum": ["warn", "skip"],
          "default": "warn",
          "description": "Deprecated: no gate reads this field, so it has no effect. It is still accepted so existing policies validate; doctor recommends removing it."
        },
        "on_missing_tests": {
          "deprecated": true,
          "type": "string",
          "enum": ["warn", "skip"],
          "default": "skip",
          "description": "Deprecated: no gate reads this field, so it has no effect. It is still accepted so existing policies validate; doctor recommends removing it."
        },
        "custom_command": {
          "type": "string",
          "description": "Shell command invoked when orchestrator == custom."
        },
        "gates": {
          "type": "object",
          "x-since": "0.5.0",
          "description": "Project gates (verify-quality only): named commands run after the orchestrator's gates, in key order, each reported as its own gate in the text report, --json and the attestation. The runtime's own gate names are reserved and refused.",
          "propertyNames": {
            "pattern": "^[a-z0-9][a-z0-9_-]{0,39}$",
            "not": {
              "enum": [
                "prettier",
                "markdownlint",
                "shellcheck",
                "task-lint",
                "task-test",
                "custom",
                "spec",
                "contract",
                "parity",
                "policy",
                "lock",
                "constitution"
              ]
            }
          },
          "additionalProperties": {
            "$ref": "#/$defs/projectGate"
          }
        },
        "gate_timeout_s": {
          "type": "integer",
          "minimum": 1,
          "maximum": 86400,
          "default": 600,
          "x-since": "0.5.0",
          "description": "Time limit in seconds for project gates without their own timeout_s (verify-quality only). A gate over its limit fails and its process group is stopped."
        },
        "test_severity": {
          "type": "string",
          "enum": ["error", "warning", "info"],
          "default": "warning",
          "x-since": "0.5.0",
          "description": "Severity of the task-test gate under the task orchestrator (verify-quality only). task-lint stays error."
        }
      }
    },
    "projectGate": {
      "type": "object",
      "additionalProperties": false,
      "required": ["command"],
      "properties": {
        "command": {
          "type": "string",
          "minLength": 1,
          "description": "Run as sh -c \"<command>\" from the project root, with GATES_BOUNDARY set to agent, git, ci or none. Exit 126 or 127 fails the gate (command not found or not executable)."
        },
        "severity": {
          "type": "string",
          "enum": ["error", "warning", "info"],
          "default": "error",
          "description": "How a non-zero exit maps: error fails the run, warning and info warn. A timeout or a command that cannot start fails whatever the severity."
        },
        "timeout_s": {
          "type": "integer",
          "minimum": 1,
          "maximum": 86400,
          "description": "Time limit in seconds; default gate_timeout_s, else 600."
        },
        "skip_at": {
          "type": "array",
          "minItems": 1,
          "uniqueItems": true,
          "items": {
            "enum": ["agent", "git"]
          },
          "description": "Earlier boundaries at which this gate does not run, by declaration; each skip is reported by name. ci cannot be named: CI runs the full policy (constitution, Principle III)."
        }
      }
    }
  }
}
