{
  "_comment": "spec-gates policy. Schema: .specify/gates/policy.schema.json. Loader: .specify/gates/lib/policy.sh. USER-OWNED: init seeds this file; upgrade never overwrites. Edit include/exclude globs, orchestrator, and severity to customize gate behavior at all three boundaries. node_modules/.venv are excluded at both top-level (name/**) and any nested depth (**/name/**) for monorepos. To inherit an org baseline policy, add \"extends\": { \"source\": \"<git url or path>\", \"version\": \"<tag or commit>\" } and run /speckit.gates.sync — this file then overlays the baseline (see feature 003).",
  "hooks": {
    "prettier": {
      "include": ["**/*.md", "**/*.yml", "**/*.yaml", "**/*.json"],
      "exclude": [
        ".specify/**",
        ".claude/**",
        "LICENSE",
        "node_modules/**",
        "**/node_modules/**",
        ".venv/**",
        "**/.venv/**"
      ],
      "orchestrator": "none",
      "severity": "error"
    },
    "markdownlint": {
      "include": ["**/*.md"],
      "exclude": [
        ".specify/**",
        ".claude/**",
        "node_modules/**",
        "**/node_modules/**",
        ".venv/**",
        "**/.venv/**",
        "target/**",
        "**/target/**"
      ],
      "orchestrator": "none",
      "severity": "error"
    },
    "shellcheck": {
      "include": ["**/*.sh"],
      "exclude": [
        ".specify/**",
        ".claude/**",
        ".git/**",
        "node_modules/**",
        "**/node_modules/**",
        ".venv/**",
        "**/.venv/**",
        "target/**",
        "**/target/**",
        "dist/**",
        "**/dist/**"
      ],
      "orchestrator": "none",
      "severity": "error"
    },
    "verify-quality": {
      "orchestrator": "none",
      "severity": "error"
    }
  },
  "protected_files": {
    "extra": [".specify/memory/constitution.md", ".specify/gates/policy.json"]
  },
  "git": {
    "block_main_commits": true,
    "conventional_commits": true,
    "forbid_ai_isms": true,
    "protected_change_trailer": true,
    "ai_branding": {
      "terms": ["Anthropic", "GPT", "OpenAI", "Copilot"],
      "allow_phrases": []
    }
  },
  "attestation": {
    "enabled": true,
    "max_records": 200,
    "parity": "error"
  },
  "spec": {
    "enabled": true,
    "severity": "error",
    "include": ["*"],
    "exclude": [],
    "timeout_s": 30
  }
}
